ID,Title,URL,Difficulty,Frequency Score,Recency,Acceptance %,Premium
11,Container With Most Water,https://leetcode.com/problems/container-with-most-water/,Medium,,,,No
15,3Sum,https://leetcode.com/problems/3sum/,Medium,,,,No
19,Remove Nth Node From End of List,https://leetcode.com/problems/remove-nth-node-from-end-of-list/,Medium,,,,No
238,Product of Array Except Self,https://leetcode.com/problems/product-of-array-except-self/,Medium,100.0%,6m+,68.6%,No
344,Reverse String,https://leetcode.com/problems/reverse-string/,Easy,,,,No
2016,Maximum Difference Between Increasing Elements,https://leetcode.com/problems/maximum-difference-between-increasing-elements/,Easy,,,,No
