ID,Title,URL,Difficulty,Frequency Score,Recency,Acceptance %,Premium
3,Longest Substring Without Repeating Characters,https://leetcode.com/problems/longest-substring-without-repeating-characters/,Medium,,,,No
13,Roman to Integer,https://leetcode.com/problems/roman-to-integer/,Easy,100.0%,6m+,66.2%,No
64,Minimum Path Sum,https://leetcode.com/problems/minimum-path-sum/,Medium,,,,No
121,Best Time to Buy and Sell Stock,https://leetcode.com/problems/best-time-to-buy-and-sell-stock/,Easy,,,,No
151,Reverse Words in a String,https://leetcode.com/problems/reverse-words-in-a-string/,Medium,100.0%,6m+,55.5%,No
154,Find Minimum in Rotated Sorted Array II,https://leetcode.com/problems/find-minimum-in-rotated-sorted-array-ii/,Hard,,,,No
160,Intersection of Two Linked Lists,https://leetcode.com/problems/intersection-of-two-linked-lists/,Easy,,,,No
217,Contains Duplicate,https://leetcode.com/problems/contains-duplicate/,Easy,,,,No
238,Product of Array Except Self,https://leetcode.com/problems/product-of-array-except-self/,Medium,,,,No
557,Reverse Words in a String III,https://leetcode.com/problems/reverse-words-in-a-string-iii/,Easy,,,,No
561,Array Partition,https://leetcode.com/problems/array-partition/,Easy,,,,No
781,Rabbits in Forest,https://leetcode.com/problems/rabbits-in-forest/,Medium,,,,No
967,Numbers With Same Consecutive Differences,https://leetcode.com/problems/numbers-with-same-consecutive-differences/,Medium,,,,No
982,Triples with Bitwise AND Equal To Zero,https://leetcode.com/problems/triples-with-bitwise-and-equal-to-zero/,Hard,100.0%,6m+,60.0%,No
