ID,Title,URL,Difficulty,Frequency Score,Recency,Acceptance %,Premium
11,Container With Most Water,https://leetcode.com/problems/container-with-most-water/,Medium,,,,No
33,Search in Rotated Sorted Array,https://leetcode.com/problems/search-in-rotated-sorted-array/,Medium,100.0%,6m+,44.1%,No
236,Lowest Common Ancestor of a Binary Tree,https://leetcode.com/problems/lowest-common-ancestor-of-a-binary-tree/,Medium,100.0%,6m+,68.7%,No
297,Serialize and Deserialize Binary Tree,https://leetcode.com/problems/serialize-and-deserialize-binary-tree/,Hard,,,,No
1283,Find the Smallest Divisor Given a Threshold,https://leetcode.com/problems/find-the-smallest-divisor-given-a-threshold/,Medium,,,,No
2433,Find The Original Array of Prefix Xor,https://leetcode.com/problems/find-the-original-array-of-prefix-xor/,Medium,,,,No
