ID,Title,URL,Difficulty,Frequency Score,Recency,Acceptance %,Premium
4,Median of Two Sorted Arrays,https://leetcode.com/problems/median-of-two-sorted-arrays/,Hard,,,,No
15,3Sum,https://leetcode.com/problems/3sum/,Medium,,,,No
424,Longest Repeating Character Replacement,https://leetcode.com/problems/longest-repeating-character-replacement/,Medium,,,,No
944,Delete Columns to Make Sorted,https://leetcode.com/problems/delete-columns-to-make-sorted/,Easy,,,,No
1423,Maximum Points You Can Obtain from Cards,https://leetcode.com/problems/maximum-points-you-can-obtain-from-cards/,Medium,,,,No
1470,Shuffle the Array,https://leetcode.com/problems/shuffle-the-array/,Easy,,,,No
1991,Find the Middle Index in Array,https://leetcode.com/problems/find-the-middle-index-in-array/,Easy,100.0%,6m+,69.1%,No
