ID,Title,URL,Difficulty,Frequency Score,Recency,Acceptance %,Premium
17,Letter Combinations of a Phone Number,https://leetcode.com/problems/letter-combinations-of-a-phone-number/,Medium,,,,No
621,Task Scheduler,https://leetcode.com/problems/task-scheduler/,Medium,,,,No
881,Boats to Save People,https://leetcode.com/problems/boats-to-save-people/,Medium,,,,No
3205,Maximum Array Hopping Score I,https://leetcode.com/problems/maximum-array-hopping-score-i/,Medium,100.0%,6m+,76.5%,Yes
3221,Maximum Array Hopping Score II,https://leetcode.com/problems/maximum-array-hopping-score-ii/,Medium,100.0%,6m+,59.5%,Yes
